{
  "legacy_workflow_id": "two-binary-patch-replay-legacy",
  "legacy_run_id": "11111111-1111-4111-8111-111111111111",
  "new_workflow_id": "two-binary-patch-replay-new",
  "new_run_id": "22222222-2222-4222-8222-222222222222",
  "removal_workflow_id": "two-binary-patch-replay-removal",
  "removal_run_id": "33333333-3333-4333-8333-333333333333",
  "events": [
    {
      "step": "stack_ready",
      "status": "ok",
      "stale_project_volumes_before_cleanup": 0,
      "remaining_project_volumes_before_start": 0,
      "temporal_healthy": true
    },
    {
      "step": "driver_accepted",
      "status": "ok",
      "scenario": "legacy",
      "workflow_id": "two-binary-patch-replay-legacy",
      "run_id": "11111111-1111-4111-8111-111111111111"
    },
    {
      "step": "history_checked",
      "status": "ok",
      "scenario": "legacy",
      "stage": "initial",
      "event_count": 5
    },
    {
      "step": "worker_generation_stopped",
      "status": "ok",
      "scenario": "legacy",
      "generation": 1,
      "container_id": "aaaaaaaaaaaaaaaaaaaaaaaaaaaaaaaaaaaaaaaaaaaaaaaaaaaaaaaaaaaaaaaa",
      "worker_version": "legacy",
      "exit_code": 0,
      "shutdown_marker": true
    },
    {
      "step": "worker_generation_removed",
      "status": "ok",
      "scenario": "legacy",
      "generation": 1,
      "container_id": "aaaaaaaaaaaaaaaaaaaaaaaaaaaaaaaaaaaaaaaaaaaaaaaaaaaaaaaaaaaaaaaa",
      "remaining_worker_containers": 0
    },
    {
      "step": "worker_generation_ready",
      "status": "ok",
      "scenario": "legacy",
      "generation": 2,
      "container_id": "bbbbbbbbbbbbbbbbbbbbbbbbbbbbbbbbbbbbbbbbbbbbbbbbbbbbbbbbbbbbbbbb",
      "worker_version": "patched",
      "readiness_generation": 2,
      "fresh_container": true
    },
    {
      "step": "replay_observed",
      "status": "ok",
      "scenario": "legacy",
      "generation": 2,
      "is_replaying": true,
      "history_length": "5",
      "branch": "old",
      "marker_count": 0,
      "marker_deprecated": null
    },
    {
      "step": "driver_completed",
      "status": "ok",
      "scenario": "legacy",
      "outcome": "completed"
    },
    {
      "step": "history_checked",
      "status": "ok",
      "scenario": "legacy",
      "stage": "terminal",
      "event_count": 16
    },
    {
      "step": "worker_generation_stopped",
      "status": "ok",
      "scenario": "legacy",
      "generation": 2,
      "container_id": "bbbbbbbbbbbbbbbbbbbbbbbbbbbbbbbbbbbbbbbbbbbbbbbbbbbbbbbbbbbbbbbb",
      "worker_version": "patched",
      "exit_code": 0,
      "shutdown_marker": true
    },
    {
      "step": "worker_generation_removed",
      "status": "ok",
      "scenario": "legacy",
      "generation": 2,
      "container_id": "bbbbbbbbbbbbbbbbbbbbbbbbbbbbbbbbbbbbbbbbbbbbbbbbbbbbbbbbbbbbbbbb",
      "remaining_worker_containers": 0
    },
    {
      "step": "driver_accepted",
      "status": "ok",
      "scenario": "new",
      "workflow_id": "two-binary-patch-replay-new",
      "run_id": "22222222-2222-4222-8222-222222222222"
    },
    {
      "step": "history_checked",
      "status": "ok",
      "scenario": "new",
      "stage": "initial",
      "event_count": 6
    },
    {
      "step": "worker_generation_stopped",
      "status": "ok",
      "scenario": "new",
      "generation": 1,
      "container_id": "cccccccccccccccccccccccccccccccccccccccccccccccccccccccccccccccc",
      "worker_version": "patched",
      "exit_code": 0,
      "shutdown_marker": true
    },
    {
      "step": "worker_generation_removed",
      "status": "ok",
      "scenario": "new",
      "generation": 1,
      "container_id": "cccccccccccccccccccccccccccccccccccccccccccccccccccccccccccccccc",
      "remaining_worker_containers": 0
    },
    {
      "step": "worker_generation_ready",
      "status": "ok",
      "scenario": "new",
      "generation": 2,
      "container_id": "dddddddddddddddddddddddddddddddddddddddddddddddddddddddddddddddd",
      "worker_version": "deprecated",
      "readiness_generation": 2,
      "fresh_container": true
    },
    {
      "step": "replay_observed",
      "status": "ok",
      "scenario": "new",
      "generation": 2,
      "is_replaying": true,
      "history_length": "6",
      "branch": "new",
      "marker_count": 1,
      "marker_deprecated": false
    },
    {
      "step": "driver_completed",
      "status": "ok",
      "scenario": "new",
      "outcome": "completed"
    },
    {
      "step": "history_checked",
      "status": "ok",
      "scenario": "new",
      "stage": "terminal",
      "event_count": 17
    },
    {
      "step": "worker_generation_stopped",
      "status": "ok",
      "scenario": "new",
      "generation": 2,
      "container_id": "dddddddddddddddddddddddddddddddddddddddddddddddddddddddddddddddd",
      "worker_version": "deprecated",
      "exit_code": 0,
      "shutdown_marker": true
    },
    {
      "step": "worker_generation_removed",
      "status": "ok",
      "scenario": "new",
      "generation": 2,
      "container_id": "dddddddddddddddddddddddddddddddddddddddddddddddddddddddddddddddd",
      "remaining_worker_containers": 0
    },
    {
      "step": "driver_accepted",
      "status": "ok",
      "scenario": "removal",
      "workflow_id": "two-binary-patch-replay-removal",
      "run_id": "33333333-3333-4333-8333-333333333333"
    },
    {
      "step": "history_checked",
      "status": "ok",
      "scenario": "removal",
      "stage": "initial",
      "event_count": 6
    },
    {
      "step": "worker_generation_stopped",
      "status": "ok",
      "scenario": "removal",
      "generation": 1,
      "container_id": "eeeeeeeeeeeeeeeeeeeeeeeeeeeeeeeeeeeeeeeeeeeeeeeeeeeeeeeeeeeeeeee",
      "worker_version": "deprecated",
      "exit_code": 0,
      "shutdown_marker": true
    },
    {
      "step": "worker_generation_removed",
      "status": "ok",
      "scenario": "removal",
      "generation": 1,
      "container_id": "eeeeeeeeeeeeeeeeeeeeeeeeeeeeeeeeeeeeeeeeeeeeeeeeeeeeeeeeeeeeeeee",
      "remaining_worker_containers": 0
    },
    {
      "step": "worker_generation_ready",
      "status": "ok",
      "scenario": "removal",
      "generation": 2,
      "container_id": "ffffffffffffffffffffffffffffffffffffffffffffffffffffffffffffffff",
      "worker_version": "removed",
      "readiness_generation": 2,
      "fresh_container": true
    },
    {
      "step": "replay_observed",
      "status": "ok",
      "scenario": "removal",
      "generation": 2,
      "is_replaying": true,
      "history_length": "6",
      "branch": "new",
      "marker_count": 1,
      "marker_deprecated": true
    },
    {
      "step": "driver_completed",
      "status": "ok",
      "scenario": "removal",
      "outcome": "completed"
    },
    {
      "step": "history_checked",
      "status": "ok",
      "scenario": "removal",
      "stage": "terminal",
      "event_count": 17
    },
    {
      "step": "worker_generation_stopped",
      "status": "ok",
      "scenario": "removal",
      "generation": 2,
      "container_id": "ffffffffffffffffffffffffffffffffffffffffffffffffffffffffffffffff",
      "worker_version": "removed",
      "exit_code": 0,
      "shutdown_marker": true
    },
    {
      "step": "worker_generation_removed",
      "status": "ok",
      "scenario": "removal",
      "generation": 2,
      "container_id": "ffffffffffffffffffffffffffffffffffffffffffffffffffffffffffffffff",
      "remaining_worker_containers": 0
    },
    {
      "step": "postgres_volume_removed",
      "status": "ok",
      "remaining_project_volumes": 0
    }
  ]
}
